{
  "id": "GrilledFishInMintSauce",
  "name": "Grilled Fish in Mint Sauce",
  "description": "Ikan panggang berbalut saus yang nikmat. Ikannya diisi dengan berbagai rempah, lalu dipanggang. Setelah dipanggang, langsung dibaluri oleh saus mint yang banyak. Sehingga aroma ikannya cukup untuk memikat selera makan siapa saja.",
  "rarity": 1,
  "ingredients": [
    {
      "id": "Fish",
      "name": "Fish",
      "amount": 1
    },
    {
      "id": "Mint",
      "name": "Mint",
      "amount": 1
    }
  ],
  "results": {
    "suspicious": {
      "name": "Suspicious Grilled Fish in Mint Sauce",
      "description": "Ikan panggang berbalut saus yang nikmat. Kuahnya yang kental menutupi rasa asli ikannya, dan aroma mint di mulut membuat penikmatnya lupa kalau ini sebenarnya adalah ikan panggang ....",
      "effect": "Memulihkan 8% Max HP dan tambahan 800 HP untuk Karakter yang dipilih."
    },
    "normal": {
      "name": "Grilled Fish in Mint Sauce",
      "description": "Ikan panggang berbalut saus yang nikmat. Ikannya diisi dengan berbagai rempah, lalu dipanggang. Setelah dipanggang, langsung dibaluri oleh saus mint yang banyak. Sehingga aroma ikannya cukup untuk memikat selera makan siapa saja.",
      "effect": "Memulihkan 9% Max HP dan 1.000 HP tambahan untuk Karakter yang dipilih."
    },
    "delicious": {
      "name": "Delicious Grilled Fish in Mint Sauce",
      "description": "Ikan panggang berbalut saus yang nikmat. Kulitnya yang renyah dan wangi, dagingnya yang empuk dan kenyal, cara memasak yang begitu bersahaja menghadirkan kelezatan yang luar biasa.",
      "effect": "Memulihkan 10% Max HP dan tambahan 1.200 HP untuk Karakter yang dipilih."
    }
  },
  "dishType": "Makanan Pemulihan",
  "version": "5.0"
}