{
  "id": "SelvaSalad",
  "name": "우림 샐러드",
  "description": "페이몬이 고심 끝에 개량한 아란나라의 샐러드. 하지만 수메르에는 이미 똑같은 레시피의 샐러드가 있었다. 뚠뚠 복숭아는 신선하고 아삭한 식감을 자랑하며 청량한 민트로 설탕의 달콤함을 대체했다. 풍미를 선사하기 위해 수메르 장미 액기스를 약간 넣었다. 미각과 후각을 동시에 사로잡는 상큼한 요리이다",
  "rarity": 2,
  "ingredients": [
    {
      "id": "ZaytunPeach",
      "name": "뚠뚠 복숭아",
      "amount": 2
    },
    {
      "id": "Mint",
      "name": "민트",
      "amount": 2
    },
    {
      "id": "SumeruRose",
      "name": "수메르 장미",
      "amount": 2
    },
    {
      "id": "ZaytunPeach",
      "name": "뚠뚠 복숭아",
      "amount": 2
    },
    {
      "id": "Mint",
      "name": "민트",
      "amount": 2
    },
    {
      "id": "SumeruRose",
      "name": "수메르 장미",
      "amount": 2
    }
  ],
  "dishType": "모험류 요리",
  "results": {
    "suspicious": {
      "name": "이상한 우림 샐러드",
      "description": "페이몬이 고심 끝에 개량한 아란나라의 샐러드. 하지만 수메르에는 이미 똑같은 레시피의 샐러드가 있었다. 뚠뚠 복숭아가 숙성을 넘어서 발효에 가까운 이상한 냄새를 풍기고 있으며 민트와 장미의 비율도 균형을 잃었다…",
      "effect": "파티 내 모든 캐릭터의 대시 시 소모하는 스태미나가 15% 감소한다. 지속 시간: 900초. 다인 모드 시 자신의 캐릭터에만 적용된다"
    },
    "normal": {
      "name": "우림 샐러드",
      "description": "페이몬이 고심 끝에 개량한 아란나라의 샐러드. 하지만 수메르에는 이미 똑같은 레시피의 샐러드가 있었다. 뚠뚠 복숭아는 신선하고 아삭한 식감을 자랑하며 청량한 민트로 설탕의 달콤함을 대체했다. 풍미를 선사하기 위해 수메르 장미 액기스를 약간 넣었다. 미각과 후각을 동시에 사로잡는 상큼한 요리이다",
      "effect": "파티 내 모든 캐릭터의 대시 시 소모하는 스태미나가 20% 감소한다. 지속 시간: 900초. 다인 모드 시 자신의 캐릭터에만 적용된다"
    },
    "delicious": {
      "name": "맛있는 우림 샐러드",
      "description": "페이몬이 고심 끝에 개량한 아란나라의 샐러드. 하지만 수메르에는 이미 똑같은 레시피의 샐러드가 있었다. 식자재로 선택한 뚠뚠 복숭아는 부드럽고 과즙이 가득하며 민트의 상큼함과 성숙한 장미에서 퍼지는 향기가 위장에 밀려 들어온다. 적당한 단맛과 시원함이 느껴진다. 이게 바로 「즐거운 맛」이 아닐까?",
      "effect": "파티 내 모든 캐릭터의 대시 시 소모하는 스태미나가 25% 감소한다. 지속 시간: 900초. 다인 모드 시 자신의 캐릭터에만 적용된다"
    }
  },
  "version": "5.0"
}