{
  "id": "CandiedAjilenakhNut",
  "name": "Doce de Mel com Tâmaras",
  "description": "Uma sobremesa suntuosa. Primeiro, a calda é fervida até ficar transparente, então é misturada com os recheios e a pasta de gergelim de Sumeru. Então, finalmente, a calda igualmente misturada é colocada em uma forma e descansa até atingir sua forma crocante. Dizem que as terras frias de Snezhnaya possuem um prato similar, com um perfil de sabor ligeiramente diferente. Claro, ambas as regiões naturalmente acreditam que a sua versão é a melhor de Teyvat.",
  "rarity": 3,
  "ingredients": [
    {
      "id": "AjilenakhNut",
      "name": "Tâmara",
      "amount": 4
    },
    {
      "id": "Almond",
      "name": "Amêndoa",
      "amount": 2
    },
    {
      "id": "Butter",
      "name": "Manteiga",
      "amount": 2
    },
    {
      "id": "SumeruRose",
      "name": "Rosa de Sumeru",
      "amount": 1
    },
    {
      "id": "AjilenakhNut",
      "name": "Tâmara",
      "amount": 4
    },
    {
      "id": "Almond",
      "name": "Amêndoa",
      "amount": 2
    },
    {
      "id": "Butter",
      "name": "Manteiga",
      "amount": 2
    },
    {
      "id": "SumeruRose",
      "name": "Rosa de Sumeru",
      "amount": 1
    }
  ],
  "dishType": "Pratos de DEF",
  "results": {
    "suspicious": {
      "name": "Doce de Mel com Tâmaras Estranho",
      "description": "Uma sobremesa rica. As nozes duras são como uma pedra escondida na areia, aguardando uma chance de atacarem. A doçura traz felicidade, mas a sensação dos pedaços duros nos dentes arruína ela.",
      "effect": "Aumenta a DEF de todos os membros da Equipe em 165 por 300s. No modo multijogador, terá efeito em si mesmo."
    },
    "normal": {
      "name": "Doce de Mel com Tâmaras",
      "description": "Uma sobremesa suntuosa. Primeiro, a calda é fervida até ficar transparente, então é misturada com os recheios e a pasta de gergelim de Sumeru. Então, finalmente, a calda igualmente misturada é colocada em uma forma e descansa até atingir sua forma crocante. Dizem que as terras frias de Snezhnaya possuem um prato similar, com um perfil de sabor ligeiramente diferente. Claro, ambas as regiões naturalmente acreditam que a sua versão é a melhor de Teyvat.",
      "effect": "Aumenta a DEF de todos os membros da Equipe em 200 por 300s. No modo multijogador, terá efeito em si mesmo."
    },
    "delicious": {
      "name": "Doce de Mel com Tâmaras Delicioso",
      "description": "Uma sobremesa rica. O mel derrete ao entrar em contato com a boca, revelando a castanha mergulhada em vermelho, cada camada levando a uma felicidade maior. Basta uma mordida para mergulhar numa banheira de doçura. Da próxima vez é melhor fazer mais!",
      "effect": "Aumenta a DEF de todos os membros da Equipe em 235 por 300s. No modo multijogador, terá efeito em si mesmo."
    },
    "special": {
      "id": "Halvamazd",
      "name": "Halvamazd",
      "description": "A especialidade da Nahida. Diz-se que Mazi significa \"sabedoria\" em Sumeru. Uma \"sabedoria\" assim requintada é realmente irresistível. Nahida exibia um sorriso suave no olhar: \"As anêmonas do mar ajudaram e testemunharam o crescimento dos peixes, então não é nada além do normal que os peixinhos quiseram dar algo em troca\".",
      "effect": "Aumenta a DEF de todos os membros da Equipe em 282 por 300s. No modo multijogador, terá efeito apenas em si mesmo.",
      "character": {
        "id": "Nahida",
        "name": "Nahida"
      }
    }
  },
  "version": "5.0"
}